{
  "oar": "0.1",
  "app_id": "Bu1JCyxiVDdDGjtNLLkKhq6KZv6E4LcUgqNkS5t5Nf2K",
  "cluster": "solana:devnet",
  "name": "Open App Registry",
  "summary": "Onchain application identity for Solana: one App ID per app, with every link proven from both sides.",
  "categories": [
    "infrastructure",
    "identity"
  ],
  "publisher": {
    "name": "GWAP"
  },
  "links": {
    "github": "https://github.com/gwapupward-hub"
  },
  "repositories": [
    {
      "url": "https://github.com/gwapupward-hub/oar",
      "role": "program"
    }
  ],
  "programs": [
    {
      "address": "oariw8YXcYJh9sa9VcmBU3ZCdo2WVGMYPsLjEuUxfrC",
      "cluster": "solana:devnet",
      "name": "OAR Registry",
      "role": "registry"
    }
  ],
  "security": {
    "contact": "https://github.com/gwapupward-hub/oar/security/advisories/new",
    "policy": "https://github.com/gwapupward-hub/oar/blob/main/SECURITY.md"
  }
}
